{
  "schemaVersion": 1,
  "id": "folk",
  "name": "Traditional Songs",
  "description": "Well-known melodies in the public domain. All titles are traditional or public domain.",
  "author": "Tab Trainer",
  "version": "1.0.0",
  "license": "public-domain",
  "attribution": "Traditional melodies in the public domain.",
  "price": { "usd": 4.99 },
  "entries": [
    {
      "id": "ode-to-joy",
      "title": "Ode to Joy",
      "type": "song",
      "category": "song",
      "difficulty": 2,
      "tags": ["classical", "public-domain", "top-strings"],
      "tuning": "standard",
      "mode": "sequence",
      "attribution": "Ludwig van Beethoven (1824), public domain.",
      "frets": [[0,0],[0,0],[0,1],[0,3],[0,3],[0,1],[0,0],[1,3],[1,1],[1,1],[1,3],[0,0],[0,0],[1,3],[1,3]]
    },
    {
      "id": "twinkle-twinkle",
      "title": "Twinkle Twinkle Little Star",
      "type": "song",
      "category": "song",
      "difficulty": 1,
      "tags": ["nursery", "public-domain", "top-strings"],
      "tuning": "standard",
      "mode": "sequence",
      "attribution": "Traditional, public domain.",
      "frets": [[1,1],[1,1],[0,3],[0,3],[0,5],[0,5],[0,3],[0,1],[0,1],[0,0],[0,0],[1,3],[1,3],[1,1]]
    },
    {
      "id": "mary-had-a-little-lamb",
      "title": "Mary Had a Little Lamb",
      "type": "song",
      "category": "song",
      "difficulty": 2,
      "tags": ["nursery", "public-domain", "top-strings"],
      "tuning": "standard",
      "mode": "sequence",
      "attribution": "Traditional, public domain.",
      "frets": [[0,0],[1,3],[1,1],[1,3],[0,0],[0,0],[0,0],[1,3],[1,3],[1,3],[0,0],[0,3],[0,3]]
    }
  ]
}
